Systems Administrator,Palmerston,"Department of Environment, Parks and Water Security",https://www.glassdoor.com.au/partner/jobListing.htm?pos=108&ao=1136043&s=58&guid=0000018524ae780a9a11a893914f60c3&src=GD_JOB_AD&t=SR&vt=w&cs=1_0bc24a1e&cb=1671357692161&jobListingId=1008313386332&jrtk=3-0-1gkiasu1hi9hm801-1gkiasu23jrqp800-d7fc060bdd11bb1f-,"$94,791",$86K,$103K,10000+ Employees,Government,-1,-1,-1,Unknown / Non-Applicable,"Job description

Agency Department of Environment, Parks and Work unit Geospatial Services Branch, Rangelands

Water Security Division

Job title Spatial Systems Administrator Designation Professional 2

Job type Full time Duration Fixed to 29/08/2024

Salary $86,204 - $103,377 Location Palmerston

Position number 4793 RTF 255730 Closing 10/01/2023

Contact Officer Maria Wauchope on 08 8999 6391 or maria.wauchope@nt.gov.au or Chris Roach at chris.roach@nt.gov.au

About the agency https://depws.nt.gov.au/

Apply online https://jobs.nt.gov.au/Home/JobDetails?rtfId=255730

Applications must be limited to a one-page summary sheet and detailed resume

Information for applicants – inclusion and diversity and Special Measures recruitment plans

The NTPS values diversity. The NTPS encourages people from all diversity groups to apply for vacancies and accommodates

people with disability by making reasonable workplace adjustments. If you require an adjustment for the recruitment process or

job, please discuss this with the contact officer. For more information about applying for this position and the merit process, go

to the OCPE website.

Under the agency’s Special Measures recruitment plan eligible Aboriginal applicants will be granted priority consideration for this

vacancy. For more information on Special Measures plans, go to the OCPE website.

Primary objective

Manage spatial systems, collation of scientific data, and development of Geographic Information Systems (GIS), databases and web

mapping applications for dissemination and accessibility to internal and external clients. As the administrator of the Department’s

spatial systems, you will support and collaborate on processes to ensure that data, technology and systems are consistently

managed and to optimise data outcomes that meet stakeholder needs.

Key duties and responsibilities

1. Manage GIS, database and web mapping application systems for the collation and dissemination of Department of

Environment, Parks and Water Security (DEPWS) natural resource datasets.

2. Coordinate and facilitate the corporate management of DEPWS natural resource datasets.

3. Participate in the development and adoption of minimum dataset standards and processes for the collection of corporate

natural resource data.

4. Provide technical advice to management of information technologies that will affect the management and provision of DEPWS

scientific data and information e.g. spatial and aspatial databases, Geographic Information Systems (GIS), business system

integrations.

5. Support the GIS and scientific database operations and processes, including training of Departmental staff.

6. Liaise with staff and external service providers to ensure the timely provision of scientific applications/databases which meet

the user’s business requirements and corporate requirements.

7. Coordinate and participate in all phases of GIS and scientific database application development as required.

Selection criteria

Essential

1. Tertiary qualifications in computer science, spatial science, environmental science or equivalent.

2. Experience in maintaining corporate spatial and scientific data, including analysis, design and implementation of relational

databases and solutions e.g. Oracle within enterprise spatial environments.

3. Ability to work within a multi-disciplinary team and liaise with all units within the Department, including to provide GIS and

related Information Communications and Technology support.

4. Experience in the use of ESRI (Earth Systems Research Institute), FME (Feature Manipulation Engine), QGIS (Quantum GIS)

and open-source software such as Python for scientific data storage and manipulation.

5. Knowledge of ArcGIS Server technology and its application for data publishing and dissemination.

6. Demonstrated ability to communicate effectively with staff, stakeholders and service providers engaged in natural resource

assessment and management or related systems.

7. Sound interpersonal, written and oral communication skills with demonstrated ability to write technical reports, data standards,

procedures and processes.

Desirable

1. Postgraduate qualifications related to spatial data, remote sensing or environmental systems.

2. Experience in the development, management and maintenance of web mapping applications.

3. Ability to engage with stakeholders, gain consensus and develop business cases for solutions to meet business needs.",4.1,92 %,N/A,0 Ratings,4.1,4.5,3.8,3.3,4.1
Senior Consultant,Stuart Park,Power Systems Consultants,https://www.glassdoor.com.au/partner/jobListing.htm?pos=109&ao=1136043&s=58&guid=0000018524ae780a9a11a893914f60c3&src=GD_JOB_AD&t=SR&vt=w&ea=1&cs=1_1bfeaadb&cb=1671357692161&jobListingId=1008191330494&jrtk=3-0-1gkiasu1hi9hm801-1gkiasu23jrqp800-fdac310048529019-,"$129,800",$108K,$156K,51 to 200 Employees,Company - Private,"Energy, Mining, Utilities",1995,Energy & Utilities,$25 to $50 million (USD),"At PSC we're helping power a more sustainable world. Our global team of electricity experts have been tackling the thorniest problems for some of the most prominent industry players for over 25 years. By empowering people to make a difference and do the right thing, we help our clients and employees innovate and thrive in a rapidly changing industry.

As a Senior SCADA/EMS Consultant, you will work with our clients on projects and day to day tasks required to update and maintain complex real-time Energy Management Systems. You will develop approaches for maintaining the system operation, patching systems, upgrading applications and versions of the client real-time platforms. You will work in a team of professionals at the client site to ensure all systems are functional and new deployments meet the clients’ functional requirements.

Key Accountabilities
Providing consultancy, project and support services.
Coordinating and managing projects in accordance with PSC’s project management methodology.
Contributing to the preparation of proposals and tender submissions.
Liaising with clients to ensure that all service and project tasks are completed to a high standard and to the satisfaction of the client.
Working collaboratively with client, PSC and third-party team members.
Participating and providing technical input at client and PSC technical meetings and discussions.
Training and mentoring of client and PSC team members.
Taking an active involvement in the ongoing improvement of processes and procedures.

Minimum Expertise
Bachelor’s degree in Electrical Engineering/Computer Science/Power Systems Engineering or related field or equivalent practical experience with certifiable competencies in the SCADA and EMS field
Minimum of ten (10) years of EMS/SCADA experience
Performing or creating training programs and mentoring junior level team members
Strong working experience with EMS vendor systems (e.g. GE, Siemens, ABB, Schneider, OSI) and applications (Historians, Alarms, Mapboard, Load Shed, Outage Scheduler, Variable Line Rating, OAG, RTNET, VAST, PSSE)
Proficiency with EMS modelling tools, display building tools, and domains (SCADA, Generation, Network, Dispatcher Training Simulator)
Proficiency with modern programming and scripting language
Experience with SQL based RDBMS databases
Excellent computer skills, including: Virtualisation, Windows server, Windows desktops, and Linux
Experience with point to point, Factory and Site Acceptance Testing
Experience integrating complex software systems
Proficiency with IPv4 networking

Attributes and Skills
Team and task leadership
Must be a team player and able to interact closely on a day-to-day basis with all parties tasked with keeping critical real time systems running
Strong desire to learn new skills and technologies – Growth Mindset
Effective at problem solving
Problem analysis, design, implementation, testing and documentation for energy management systems
Utility operational technology project and support experience and mindset
Basic understanding of the day-to-day operations of a power utility control room
Knowledge of maintaining IT infrastructure that supports real-time critical business systems

Opportunity Benefits
Competitive salary and benefits package
Opportunity to join an established and growing global organization
Join a highly collaborative worldwide team of professionals
Be a part of a team that drives the industry forward
Join a team that values people, giving them the opportunity to develop their career direction

We're an equal opportunity employer. All applicants will be considered for employment without attention to race, color, religion, sex, sexual orientation, gender identity, national origin, veteran or disability status. Please note that by applying to this job you consent to the personal data you provide to us to be processed and retained by The PSC Group. Your details will be kept on our internal ATS (Applicant Tracking System) for up to 12 months for the purposes of recruitment, which may include your details being shared with our internal hiring manager(s) and for consideration for potential future opportunities by PSC. For full details of our privacy policy please look here.",4.0,65 %,51 %,"Alex Boyd
6 Ratings",3.5,3.7,3.7,3.5,3.5
Technician,Australia,Anindilyakwa Land Council (ALC),https://www.glassdoor.com.au/partner/jobListing.htm?pos=111&ao=1136043&s=58&guid=0000018524ae780a9a11a893914f60c3&src=GD_JOB_AD&t=SR&vt=w&cs=1_a64c04f6&cb=1671357692162&jobListingId=1008170436322&jrtk=3-0-1gkiasu1hi9hm801-1gkiasu23jrqp800-dae949ddc5df9c77-,-1,-1,-1,,,,,,,"Vacant Position


About Groote Aqua
Groote Aqua Aboriginal Corporation (GAAC) is developing a novel and sustainable blue
economy in the Groote archipelago (Gulf of Carpentaria, NT) and is currently transitioning
from R&D towards commercialisation.
The marine species under investigation include Blacklip oyster (S. echinata), tropical rock
lobster (P. ornatus), sea cucumber (H. scabra) and seaweed.
Our mission is to produce high quality seafood while safeguarding the local pristine
environment and developing a clean blue economy with and for the local Indigenous people
of the Groote archipelago.

About the Role
The GAAC is seeking a full time Marine Hatchery Technician to join our team on Groote
Eylandt.

Key responsibilities:
• Larval rearing (fish, oyster, sea cucumber) and algae production
Water quality management
Spat and broodstock management
Site and system maintenance including data collection and analysis, biosecurity
protocols and WHS
Scope for additional responsibility for capable candidates
Position Title: Hatchery Technician
Location: Groote Eylandt
Employment Type: Full Time
Application Closes: Extended to 9th October 2022
Selection Criteria
• Demonstrated experience working in a marine shellfish hatchery
A minimum diploma level qualification in aquaculture/science or equivalent
experience
Demonstrated experience in algal production and larval rearing
Exceptional organisational skills and a demonstrated capacity to work independently
and lead by example
Hands-on experience maintaining, repairing or building new land-based aquaculture
systems
Positive and constructive team member with an excellent work ethic
Ability to work weekends and take part in an on-call roster
Current driver’s licence
Desirable Requirements
• Previous experience in an oyster hatchery
Previous experience working at a remote location
Provide CPR (HLTAID001)
Provide First Aid (HLTAID003)
AMSA tickets (COXSWAIN NC2 or above)
Forklift licence
Other Information
Accommodation suitable for a single person is provided with this position. An attractive
remuneration package will be negotiated with the successful applicant, including Holiday
Travel Allowance, relocation assistance and 5 weeks annual leave.
Pre-employment screening, including an AFP criminal record check, may be undertaken on
the person who is being recommended for appointment.
This position is fixed term for one year with opportunity to become ongoing with
development for the right candidate.
For more information please email vthepot@alcnt.com.au.
How to apply
To apply for this position, please submit your resume and cover letter addressing the
selection criteria to humanresources@alcnt.com.au",,,,,,,,,
Systems Analyst,Darwin,Department of Corporate and Digital Development,https://www.glassdoor.com.au/partner/jobListing.htm?pos=112&ao=1136043&s=58&guid=0000018524ae780a9a11a893914f60c3&src=GD_JOB_AD&t=SR&vt=w&cs=1_59737431&cb=1671357692162&jobListingId=1008348854267&jrtk=3-0-1gkiasu1hi9hm801-1gkiasu23jrqp800-3c664175284cd0e3-,"$98,079",$93K,$104K,10000+ Employees,Government,-1,-1,-1,Unknown / Non-Applicable,"Job description

Agency Department of Corporate and Digital Development Work unit Agency Business Systems – Justice and

General Government

Job title System Analyst - Security Designation Administrative Officer 6

Job type Full time Duration Ongoing

Salary $92,620 - $103,538 Location Darwin

Position number 43882 RTF 257868 Closing 11/01/2023

Contact Officer Jeffrey Braam on 0436 474 692 or jeffrey.braam@pfes.nt.gov.au

About the agency https://dcdd.nt.gov.au/

Apply online https://jobs.nt.gov.au/Home/JobDetails?rtfId=257868

Applications must be limited to a one-page summary sheet and detailed resume

Information for applicants – inclusion and diversity and Special Measures recruitment plans

The NTPS values diversity. The NTPS encourages people from all diversity groups to apply for vacancies and accommodates people with

disability by making reasonable workplace adjustments. If you require an adjustment for the recruitment process or job, please discuss

this with the contact officer. For more information about applying for this position and the merit process, go to the OCPE website.

Under the agency’s Special Measures recruitment plan eligible Aboriginal applicants will be granted priority consideration for this

vacancy. For more information on Special Measures plans, go to the OCPE website.

Primary objective

Under the direction of the Senior Systems Analyst, provide expert services regarding systems security to support the delivery of critical

ICT systems, applications and technological solutions within client agencies.

Context statement

Agency Business Systems (ABS) – Justice and General Government (JGG) manage client agencies’ core business digital systems through

their life cycle from strategy to design, development, release and deployment, operational delivery, maintenance, support and retirement.

Key duties and responsibilities

1. Provide specialist technical advice and expertise regarding ICT agency applications and business systems, including the assessment,

analysis, design, development, testing, documentation and implementation of solutions to problems and requests for change in

accordance with approved policies and processes.

2. Identify and manage security risks by implementing controls to maintain the integrity of systems’ security architecture, especially to

protect private and sensitive information and mitigate/eliminate the risk of equipment and data loss, theft or tampering.

3. Conduct regular security reviews and compliance testing to ensure adherence to legislative requirements and industry standards,

making adjustments as necessary to address any issues, changes and improvement opportunities.

4. Diagnose and resolve technical problems in consultation with clients, external service providers, vendors and DCDD colleagues.

5. Assist to develop and implement work instructions for the use of front-line service support staff to ensure a consistent approach to

user profiling and resolution of routine issues.

6. Work with clients, external service providers, vendors and ABS colleagues to diagnose and resolve technical problems, with an

emphasis on building and maintaining effective stakeholder and client relationships to support the delivery of projects on time and

within budget.

7. Stay abreast of trends within areas of responsibility to ensure provision of quality and contemporary support and advice.

Selection criteria

Essential

1. Well-developed knowledge of enterprise level information technology management systems, applications to successfully support

and/or undertake technical investigations, analyse and resolve issues.

2. Thorough working knowledge of system security as it applies to access control, audit and accountability, configuration and awareness.

3. Good knowledge of systems lifecycle development applicable to specific areas of ICT specialisation in order to support the delivery

of critical ICT systems, applications and technological solutions to client agencies.

4. Applied knowledge of contemporary analytical and project management theory, best practice and tools (e.g., Information Technology

Infrastructure Library ITIL®), including research techniques, governance requirements, risk management and evaluation.

5. Knowledge of consultation, negotiation and conflict resolution approaches, particularly to resolve issues with multiple stakeholders.

6. Effective interpersonal, verbal and written communication skills, and demonstrated success cultivating productive working

relationships with people of diverse professional and cultural backgrounds.

7. Demonstrated work ethic and attitude which emulates DCDD values of being professional, accountable, honest, innovative and

respectful.

Desirable

1. Degree level tertiary qualification in a relevant discipline, e.g., ICT, Computer Science, Business Administration.

2. Relevant ITIL® qualification or similar certification.

Further information

The selected applicant must consent to a probity check to confirm they have no significant criminal history record or associations. A pre-

requisite for the probity check is permanent residency or Australian citizenship.",4.1,92 %,N/A,0 Ratings,4.1,4.5,3.8,3.3,4.1
Non Title Manager,Palmerston,"Department of Environment, Parks and Water Security",https://www.glassdoor.com.au/partner/jobListing.htm?pos=113&ao=1136043&s=58&guid=0000018524ae780a9a11a893914f60c3&src=GD_JOB_AD&t=SR&vt=w&cs=1_3c94dcba&cb=1671357692162&jobListingId=1008313386358&jrtk=3-0-1gkiasu1hi9hm801-1gkiasu23jrqp800-6cee320e2f62828b-,"$130,797",$124K,$138K,10000+ Employees,Government,-1,-1,-1,Unknown / Non-Applicable,"Job description

Agency Department of Environment, Parks and Work unit Geospatial Services Branch, Rangelands

Water Security Division

Job title Manager Geospatial Services Designation Senior Professional Officer 1

Job type Full time Duration Fixed to 20/02/2024

Salary $123,559 - $138,034 Location Palmerston

Position number 13079 RTF 255712 Closing 10/01/2023

Contact Officer Maria Wauchope on 08 8999 6391 or maria.wauchope@nt.gov.au or Chris Roach at chris.roach@nt.gov.au

About the agency https://depws.nt.gov.au/

Apply online https://jobs.nt.gov.au/Home/JobDetails?rtfId=255712

Applications must be limited to a one-page summary sheet and detailed resume

Information for applicants – inclusion and diversity and Special Measures recruitment plans

The NTPS values diversity. The NTPS encourages people from all diversity groups to apply for vacancies and accommodates

people with disability by making reasonable workplace adjustments. If you require an adjustment for the recruitment process or

job, please discuss this with the contact officer. For more information about applying for this position and the merit process, go

to the OCPE website.

Under the agency’s Special Measures recruitment plan eligible Aboriginal applicants will be granted priority consideration for this

vacancy. For more information on Special Measures plans, go to the OCPE website.

Primary objective

Manage the Geospatial Services team within the Rangelands Division to provide accessible and relevant natural resource spatial

data, information, products and services to internal and external clients. As the manager of the Geospatial Services team, you will

support and collaborate on processes that ensure Departmental data, technology and systems are consistently managed and to

optimise data outcomes that meet stakeholder needs.

Key duties and responsibilities

1. Provide leadership to the Geospatial Services team and ensure the implementation of the Department’s policies enabling it to

meet the Governments strategies.

2. Ensure cost effective utilisation of the Geospatial Services resources through team management, innovation, continuous

improvement while nurturing a best practice environment.

3. Ensure spatial and mapping data of high quality are available to relevant clients both within Government and the private sector.

4. Provide high level strategic advice to the Department on the use and configuration of spatial data and mapping systems into

the future.

5. Development and implementation of Departmental strategies and processes for best practice natural resource data and

information management.

Selection criteria

Essential

1. Tertiary qualifications in environmental science, natural resource management, information technology (IT) or equivalent.

2. High level of contemporary management skills including program planning, project management, staff professional

development, budgeting and managing output performance.

3. Ability to lead a multi-disciplinary team of spatial professionals and technicians, and liaise with a range of staff across the

Department.

4. Extensive knowledge and experience in the spatial and information systems industry, including experience with GIS

(Geographic Information Systems) and remote sensing software, web mapping technology, relational databases and system

change management.

5. Demonstrated ability to communicate effectively with staff, stakeholders and service providers engaged in natural resource

assessment and management or related systems.

6. Excellent interpersonal, written and oral communication skills with demonstrated ability to produce compelling business cases,

technical reports, standards and processes.

Desirable

1. Postgraduate qualifications related to spatial data and systems.

2. Knowledge of ESRI (Earth Systems Research Institute), FME (Feature Manipulation Engine), QGIS (Quantum GIS) and open-

source software including desktop and server products.

3. Knowledge of natural resource assessment and management in tropical and arid environments.",4.1,92 %,N/A,0 Ratings,4.1,4.5,3.8,3.3,4.1
