Mining Officer,Alice Springs,"Department of Industry, Tourism and Trade",https://www.glassdoor.com.au/partner/jobListing.htm?pos=118&ao=1136043&s=58&guid=0000018524ae780a9a11a893914f60c3&src=GD_JOB_AD&t=SR&vt=w&cs=1_a06dd772&cb=1671357692163&jobListingId=1008341562307&jrtk=3-0-1gkiasu1hi9hm801-1gkiasu23jrqp800-b06e277825862cd6-,"$74,302",$65K,$84K,201 to 500 Employees,Government,-1,-1,-1,Unknown / Non-Applicable,"Job description

Agency Department of Industry, Tourism and Work unit Mining Operations, Central Mining Team

Trade

Job title Mining Officer Designation Professional 1

Job type Full Time Duration Ongoing

Salary $64,904 - $83,700 Location Alice Springs

Position number 33980 RTF 256792 Closing 08/01/2022

Contact officer Michelle Kassman, Mining Team Manager on 08 8999 5450 or michelle.kassman@nt.gov.au

About the agency https://industry.nt.gov.au/

Apply online https://jobs.nt.gov.au/Home/JobDetails?rtfId=256792

Applications must be limited to a one-page summary sheet and detailed resume

Information for applicants – Inclusion and diversity and Special measures

The NTPS values diversity. The NTPS encourages people from all diversity groups to apply for vacancies and

accommodates people with disability by making reasonable workplace adjustments. If you require an adjustment for the

recruitment process or job, please discuss this with the contact officer. For more information about applying for this

position and the merit process, go to the OCPE website.

Under the agency’s Special Measures Recruitment Plan eligible Aboriginal and Torres Strait Islander (Aboriginal) applicants

will be granted priority consideration for this vacancy. For more information on Special Measures, go to the OCPE website.

Primary objective

To conduct assessment of mining proposals and compliance reporting under the Northern Territory Mining Management

Act 2001 (MMA).

Context statement

Mining Operations is responsible for the administration of the MMA from the assessment of projects for authorisation to

regulation of approved mining activities to closure. Functions of Mining Operations include administrative and technical

assessment of mining management plans and environmental mining reports, issue of authorisations and related compliance

activities such as field based inspections, audits and environmental monitoring. The Mining Officer will apply knowledge to

support Mines Division activities and Department and Government strategies.

Key duties and responsibilities

1. Facilitate administration of the Mining Management Act 2001 on mining sites related to (or including) mining,

exploration or extractive mineral operations

2. Act as a point of contact for mining operators and provide advice in relation to mining activities.

3. Assess Mining Management Plans (MMP) and related documentation governing mining, exploration and extractive

mineral operations for compliance with the Mining Management Act 2001.

4. Contribute to inspections and audits of operating mining, extractive and exploration sites to assess compliance with

the conditions of Authorisation and relevant legislation.

5. Contribute to the evaluation and management of environmental security bond calculations for mining activities, in

keeping with requirements under the Mining Management Act 2001 and government policy.

6. Participate in and undertake other duties as required by the Team Manager, Manager Mining Operations or the

Director Mining Operations, including regulatory compliance and enforcement activities.

Selection criteria

Essential

1. Tertiary qualification in mining related Engineering, Environmental Science or a related discipline.

2. Knowledge of environmental management relevant to the mining industry.

3. Ability to work effectively as part of a team and with people from a variety of cultural backgrounds.

4. Ability to communicate effectively with a variety of stakeholders including technical staff, clients and senior

management using both oral and written skills.

5. Knowledge of the evaluation of environmental management plans and systems relevant to mining, exploration or

extractive mineral operations.

6. A NT driver’s license suitable to operate a manual vehicle, or ability to obtain one, and a willingness and ability to travel

and undertake fieldwork, including short stays, in regional and remote areas of the NT.

Desirable

1. Knowledge of major issues confronting the mining industry and best practice in environmental management to limit

negative environmental impacts of mining activities.

2. GIS capabilities for mapping and management of spatial data.

Agency Department of Industry, Tourism and Work unit Mining Operations, Central Mining Team

Trade

Job title Mining Officer Designation Professional 2

Approved: 1/06/2022 Roslyn Vulcano, Executive Director, Mining Operations

Office of the Commissioner for Public Employment

Page 1 of 2

Job description

Job type Full Time Duration Ongoing

Salary $86,204 - $103,377 Location Alice Springs

Position number 33980 RTF 256792 Closing 08/01/2022

Contact officer Michelle Kassman, Mining Team Manager on 08 8999 5450 or michelle.kassman@nt.gov.au

About the agency https://industry.nt.gov.au/

Apply online https://jobs.nt.gov.au/Home/JobDetails?rtfId=256792

Applications must be limited to a one-page summary sheet and detailed resume

Information for applicants – Inclusion and diversity and Special measures

The NTPS values diversity. The NTPS encourages people from all diversity groups to apply for vacancies and

accommodates people with disability by making reasonable workplace adjustments. If you require an adjustment for the

recruitment process or job, please discuss this with the contact officer. For more information about applying for this

position and the merit process, go to the OCPE website.

Under the agency’s Special Measures Recruitment Plan eligible Aboriginal and Torres Strait Islander (Aboriginal) applicants

will be granted priority consideration for this vacancy. For more information on Special Measures, go to the OCPE website.

Primary objective

To conduct assessment of mining proposals and compliance reporting under the Northern Territory Mining Management

Act 2001 (MMA).

Context statement

Mining Operations is responsible for the administration of the MMA from the assessment of projects for authorisation to

regulation of approved mining activities to closure. Functions of Mining Operations include administrative and technical

assessment of mining management plans and environmental mining reports, issue of authorisations and related compliance

activities such as field based inspections, audits and environmental monitoring. The Mining Officer will apply knowledge

to support Mines Branch activities and department and government strategies.

Key duties and responsibilities

1. Facilitate administration of the Mining Management Act 2001 on mining sites related to (or including) mining,

exploration or extractive mineral operations

2. Act as a point of contact for mining operators and provide advice in relation to mining activities.

3. Assess Mining Management Plans (MMP) and related documentation governing mining, exploration and extractive

mineral operations for compliance with the Mining Management Act 2001.

4. Contribute to inspections and audits of operating mining, extractive and exploration sites to assess compliance with

the conditions of Authorisation and relevant legislation.

5. Contribute to the evaluation and management of environmental security bond calculations for mining activities, in

keeping with requirements under the Mining Management Act 2001 and government policy.

6. Participate in and undertake other duties as required, including regulatory compliance and enforcement activities.

Selection criteria

Essential

1. Tertiary qualification in mining related Engineering, Science or a related discipline.

2. Demonstrated knowledge and experience in the field of environmental management relevant to the mining industry.

3. Demonstrated ability to work effectively as part of a team and with people from a variety of cultural backgrounds.

4. Demonstrated ability to communicate effectively with a variety of stakeholders including technical staff, clients and

senior management using both oral and written skills.

5. Demonstrated ability to effectively and efficiently evaluate mining management plans and systems relevant to mining,

exploration or extractive mineral operations.

6. A NT driver’s license suitable to operate a manual vehicle, or ability to obtain one, and a willingness and ability to travel

and undertake fieldwork, including short stays, in regional and remote areas of the NT.

Desirable

1. Knowledge of major issues confronting the mining industry and best practice in environmental management to limit

negative environmental impacts of mining activities.

2. GIS capabilities for mapping and management of spatial data.",,,,,,,,,
IT Manager,Alice Springs,Leidos,https://www.glassdoor.com.au/partner/jobListing.htm?pos=119&ao=1136043&s=58&guid=0000018524ae780a9a11a893914f60c3&src=GD_JOB_AD&t=SR&vt=w&cs=1_8c6c4484&cb=1671357692163&jobListingId=1008329678623&jrtk=3-0-1gkiasu1hi9hm801-1gkiasu23jrqp800-819c4484fde3d352-,"$162,000",$105K,$219K,10000+ Employees,Company - Public,Aerospace & Defence,1969,Aerospace & Defence,$10+ billion (USD),"Description
Job Description:
The Integrated Solutions Division at Leidos is currently seeking an Information Technology (IT) Manager to support the OASIS program requirements in a challenging, dynamic setting located at a remote operating facility in the Alice Springs, Australia area. The position requires an active TS/SCI with Polygraph security clearance.
Provide all customer-facing aspects for Platform IT Operations across multiple development, test, integration, and production environments, including a worldwide service desk, major incident management, day-to-day operational support, and end-to-end customer relationship management. Includes all service management capabilities to ensure IT Operations is meeting platform service requirements across the system.
Manage Government-Contractor IT Systems and serve as the primary technical and managerial interface between the Contractor and the Government Customer
Manage and oversee the maintenance and operational performance of IT-managed applications once they have been placed in production.
Offer innovative solutions that meet clients’ needs while remaining cost effective and help with process improvements
Ensure successful operation of current technologies while determining future operational technologies that will improve stability and scalability.
Manage projects by creating timelines, adhering to budgets, and assigning staff members
Track progress against the plan and create metrics
Create reports for top management of system overview, performance, upcoming features, etc.
Provide technical leadership for the integration of requirements, design, and technology.
Work as communicator, and collaborator in a multi project, multi contractor environment.
Identify and communicate risks in a timely manner
Develop and maintain operational plans and procedures and records of status, risks, issues, and completed projects.
Basic Qualifications
Requires a BS degree in Information Technology, Computer Science, or Information Systems Management, or equivalent experience and 12-15 years of prior relevant experience or Masters with 10-13 years of prior relevant experience
Minimum of five (5) years’ experience managing projects of similar size, scope, and complexity
Minimum of two (2) consecutive years of supervisory experience in IT management
Active TS/SCI with a Polygraph is required
Certified IT professional
Demonstrated experience in help desk activities, recapitalization, networks, development of system security plans, and protected communication technologies
Ability to work in a fast-paced, collaborative team environment
Documented experience in IC IT systems including implementing INFOSEC policies and procedures
Experience providing high quality customer service
Strong problem-solving skills oral and written communication skills.
Excellent decision-making ability and sound judgment with strong attention to detail.
Preferred Qualifications
ITIL Certification. Experience with ITIL service management processes and tools
Experience with creating presentations, reports and metrics
Expertise in managing transaction workflow and messaging middleware solutions, including queues, messaging middleware, and other types of connectivity software that control message queues or transaction flows
Experience with creating and tracking plans
Pay Range:
Pay Range $105,300.00 - $162,000.00 - $218,700.00
The Leidos pay range for this job level is a general guideline only and not a guarantee of compensation or salary. Additional factors considered in extending an offer include (but are not limited to) responsibilities of the job, education, experience, knowledge, skills, and abilities, as well as internal equity, alignment with market data, applicable bargaining agreement (if any), or other law.",3.9,78 %,87 %,"Roger A. Krone
1249 Ratings",3.8,3.6,3.8,3.6,4.0
Technical Analyst,Darwin,"Department of Industry, Tourism and Trade",https://www.glassdoor.com.au/partner/jobListing.htm?pos=120&ao=1136043&s=58&guid=0000018524ae780a9a11a893914f60c3&src=GD_JOB_AD&t=SR&vt=w&cs=1_6471f585&cb=1671357692164&jobListingId=1008336863464&jrtk=3-0-1gkiasu1hi9hm801-1gkiasu23jrqp800-1f6f60fe783417f6-,"$67,647",$63K,$72K,201 to 500 Employees,Government,-1,-1,-1,Unknown / Non-Applicable,"Job description

Agency Department of Industry Tourism and Work unit Plant Industries Agriculture Branch -

Trade Berrimah Farm Science Precinct

Job title Technical Officer Designation Technical 2

Job type Full time Duration Fixed for 7 months

Salary $63,408 - $71,885 Location Darwin

Position number 92220189 RTF 257334 Closing 22/12/2022

Contact officer Upendra Shekhawat on 08 8999 2017 or Upendra.shekhawat@nt.gov.au

About the agency https://industry.nt.gov.au/

Apply online https://jobs.nt.gov.au/Home/JobDetails?rtfId=257334

Applications must be limited to a one-page summary sheet and detailed resume

Information for applicants – inclusion and diversity and Special Measures recruitment plans

The NTPS values diversity. The NTPS encourages people from all diversity groups to apply for vacancies and accommodates

people with disability by making reasonable workplace adjustments. If you require an adjustment for the recruitment

process or job, please discuss this with the contact officer. For more information about applying for this position and the

merit process, go to the OCPE website.

Under the agency’s Special Measures recruitment plan eligible Aboriginal applicants will be granted priority consideration

for this vacancy. For more information on Special Measures plans, go to the OCPE website.

Primary objective

Under the general direction of senior staff and in line with the Department of Industry, Tourism and Trade (DITT) Strategic

Plan – provide assistance with the establishment, implementation and management of field trials or experiments in a range

of horticulture industries in the Top End.

Key duties and responsibilities

1. Assist with research trials, demonstration sites and extension projects through sustainable management practices on a

range of agricultural crops in conjunction with DITT staff and stakeholders.

2. Collect data associated with research, extension and development projects; and contribute in preparation of draft

outputs.

3. Participate in the development of research and extension programs within the Plant Industries.

4. Assist in planning and coordination of demonstrations, field-days and show displays for producers to the general public.

5. Assist in supervising and training the support staff and students to implement the day-to-day field activities.

6. Participate in maintenance and upkeep of the horticulture blocks.

7. Develop and implement skills to maintain and operate specialist field equipment and machinery in an operational farm

setting, with a focus on horticultural operations.

Selection criteria

Essential

1. An appropriate Certificate/Diploma or equivalent in agriculture/horticulture or similar relevant work experience.

2. Demonstrated communication and interpersonal skills and the ability to work as a member of a team.

3. Proven ability to safely use chemicals and to operate and maintain machinery and other equipment relevant to

horticultural and other plant production.

4. Ability to compile technical information for use in preparation of technical articles and research reports.

5. Ability to work independently, forward plan and develop personal work programs, as well as being able to function as

an effective team member.

6. Experience in use of computer software such as email, spreadsheets and word processing.

7. Current NT drivers licence or ability to obtain.

Desirable

1. Training in the use of machinery and plant equipment including chemical users (ChemCert NT) certificate.

2. Knowledge of growing horticultural crops in field and glasshouse environment.

Further information

This position will be based at Berrimah Farm Science Precinct and will require some travel to other regional research facilities.",,,,,,,,,
Accountant Manager,Northern Territory,CS Executive Group,https://www.glassdoor.com.au/partner/jobListing.htm?pos=122&ao=1136043&s=58&guid=0000018524ae780a9a11a893914f60c3&src=GD_JOB_AD&t=SR&vt=w&cs=1_f5ad7149&cb=1671357692164&jobListingId=1008179954731&jrtk=3-0-1gkiasu1hi9hm801-1gkiasu23jrqp800-8915df1fcd527c34-,-1,-1,-1,Unknown,Company - Public,-1,-1,-1,Unknown / Non-Applicable,"Australia, Northern Territory, Queensland, Victoria, Western Australia
Contract/Temp
03/10/2022
Rare Opportunities to work for a Federal Government Department
Quality- and Systems-focused roles within Plant Biosecurity
Competitive Salary and Working Conditions
Several positions in separate laboratories across Australia

CLIENT
Our client is the Biosecurity Plant Division of a Federal Government Department, which protects industry and the community and maintains and helps industry benefit from Australia’s favourable plant health status.
Biosecurity Plant Division provides a contemporary, responsive, sustainable, intelligence-led and science-based plant biosecurity system that protects Australia’s plant health status. The division supports agricultural productivity, competitiveness and market access for plant and plant products imports and exports. The division pursues new market access for Australian exporters, particularly opportunities arising from finalised free trade agreements. Biosecurity Plant division protects industry and the community and maintains and helps industry benefit from Australia’s favourable plant health status.
The Science and Surveillance Group (SSG) is the department’s team of scientists, technical, and support staff who provide on-the-ground operational advice, surveillance, and diagnostic services for the department around Australia.

THE ROLE
Have you worked in Micro, Food, Pharma or Pathology?
We have a wonderful opportunity based in the Northern suburbs of Melbourne for a Quality Specialist experienced in implementing and managing ISO 17025 quality systems. This role is offered as a contract or a fixed-term tenure and will require the successful candidate to work 37.5 hours per week, Monday to Friday. The Division has a pre-approved budget for 3 years which will be split into three consecutive 12-month tenures.
The laboratories have commenced their journey towards compliance with ISO 17025. Under the general direction of the Laboratory Manager and the SSG Director, the successful candidate will ensure the laboratory manages its quality assurance program tasks with the ultimate goal of obtaining full accreditation.
Some of your tasks will include:
Undertake and facilitate a range of administrative and assurance activities that contribute to the efficient and effective operation of the laboratory.
Communicate, coordinate, report, and undertake, where applicable, activities relating to the laboratory equipment maintenance schedule, calibration, servicing, and repair.
Apply knowledge of relevant legislative and reporting requirements, quality assurance standards and procedures, and best-practice models to ensure strong levels of regulatory compliance.
Enter data and maintain manual and computer-based records with a high level of accuracy and in accordance with laboratory protocols.
Undertake quality control auditing, verification, and inspection, including maintaining quality management systems and liaising with staff, as required.
Contribute to the development and implementation of systems improvement initiatives, including a laboratory information management system (LIMS).
Work independently or under limited guidance and with a high level of initiative, integrity, and flexibility to support the work practices of the team and the day-to-day operations of the laboratory, including management of WHS and biosecurity containment infrastructure and procedures.
Promote and ensure compliance with departmental WH&S, Quality, and Environmental Management System policies and guidelines, which shall extend to actively reporting risks and opportunities for improvement in relation to these systems.

SELECTION CRITERIA
To be successful in your application you will need to meet the following criteria:
Relevant tertiary qualifications in biological sciences such as microbiology, or in the agriculture sector such as plant pathology, horticultural science, entomology, weed science, physiology etc.
Formal certifications in quality management systems are highly regarded but not necessary.
Experience in management system compliance, administration, internal auditing, record keeping and reporting including management of system schedules.
Laboratory experience with knowledge in at least one area of microbiology, molecular biology, pathology (human or plant), entomology, botany, or another relevant field.
A deep understanding of quality assurance and quality control activities and how these apply to laboratory tasks and associated record keeping.
Knowledge of Biosecurity containment is well regarded.
Well-developed ability to coordinate task allocation and provide timely and quality evidence-based contributions.
Well-developed ability to record data, analyse information and prepare reports and documentation.
Ability to think laterally, solve problems and implement innovative solutions to improve existing practices under limited supervision.
Well-developed ability to communicate and successfully complete tasks within a group with competing priorities and varying stakeholder engagement.
Ability to safely prepare laboratory consumables and reagents using aseptic techniques.
Excellent at building and sustaining positive relationships with team members and stakeholders.
You must be an Australian Citizen with the ability to obtain and maintain a Baseline Security Clearance.

APPLICATIONS
To obtain more information about these opportunities, please contact Helen on 0438 620 434 or helen@csexecgroup.com.
Alternatively, if you feel you have all the information you need, click the ‘Apply’ button to commence your application by submitting both a Resume and Cover Letter (MS Word format is preferred). Remember to indicate which state or territory laboratory you’d wish to be considered for.

THANK YOU
Given we appreciate the effort it requires to express an interest in response to a job advert, CS Executive Group thanks you in advance for your time in applying for this role. Unfortunately, due to the large volume of applications we receive daily, we typically only contact individuals who we consider as having suitable qualifications and experience to be assessed further for shortlisting.
Nevertheless, if on this occasion you’re unsuccessful, please note your details will be added to our Talent Pool database—you might therefore be contacted by us for suitable roles arising in the future.
Please follow our LinkedIn page to be notified when we have new job opportunities:
www.linkedin.com/company/cs-executive-group/
Print
Copy Link
LinkedIn
Facebook
Twitter
Apply Now",,,,,,,,,
