Job Title,Job Location,Company,Url,Estimate Base Salary,Low Estimate,High Estimate,Company Size,Company Type,Company Sector,Company Founded,Company Industry,Company Revenue,Job Descriptions,Company Rating,Company Friend Reccomendation,Company CEO Approval,Companny Number of Rater,Company Career Opportinities,Compensation and Benefits,Company Culture and Values,Company Senior Management,Company Work Life Balance
Senior Software Engineer,Australia,Telstra,https://www.glassdoor.com.au/partner/jobListing.htm?pos=201&ao=1110586&s=58&guid=0000018524ae7e91a57a04410fc671a5&src=GD_JOB_AD&t=SR&vt=w&cs=1_3cc4fbc3&cb=1671357693856&jobListingId=1008353134195&cpc=3BA4CE39D5B5DEF5&jrtk=3-0-1gkiasvlt2ea4001-1gkiasvmfjrqp800-a5ac0f01be1be342--6NYlbfkN0CdG0mlcq8sM0kM4Z0XjE22y1IvS4TfdSBI7lJNBQS5z4B9TWRpKxFPmcfKJdc8NfYBs9yTFDVuRI5tcXXO5kQtQ3m_j3zCxrKM6Pm32bjb5tA0mv04OyjEkuA6BIlLCgsBKb2yM5xSYMThWTmIY8V7HJOWjmDZ6ounvaz4IgpWwE6hIbZffyYt_CBH_jjSfnkvAzmGGto2X767lTC7mfHrnIW9x6Q4bTa7Sx_dfl8NoGBE7NaYRzorHOOigm5c5RYINbesoUcnK5rfHR4hsDG_Vdcg39ozGz6yyGlQo9HY9WBl336s2dns7NsPVqLVtjBzdMzxzCDOcjvM9Gf8a0vPBTxje1Jf7BV5KlHQjgPxnDT67w37oai25UTQOZT1o6trWfdOGw8Cbe0GDTmu3cm1UvocJ1uRYgX0BL8MVQo9AQSyROnyphJQ26LomxI3AdgacG63rUH-tsMn0oIiWr45VA3cZQFDyfahM_ySKOCZqwS2mhkt-6L7CGgMjoKicg3oRQK2TKTdUT1BVW43BLl1rmAgqXCl8bqep0L7v5k82ywkWvxHMQp_BTiJo5Lt5YpJe0JY0-gGeeHQwPDk8oVir0fdnjEUlhbOc7YFmB6hiRhvk-5chHLnPaMc5yplEokLQDlEBP8yzhGbsYUtLqsVco3OwxK0DyY%3D,-1,-1,-1,10000+ Employees,Company - Public,Telecommunications,1901,Telecommunications Services,$10+ billion (USD),"Employment Type
Permanent
Closing Date
23 Dec 2022 11:59pm
Job Title
Senior Developer
Job Summary
The Network Engineering-Senior Engineer is a critical contributor in ensuring that the Telstra network delivers a superior network experience for our consumer and business customers. You do this by drawing on your deep levels of telecommunications network expertise and experience to provide specialist analysis, design, development and deployment in network specific technology domains, including developing platform specific technology roadmaps and making technology investment recommendations.
Job Description
At Telstra, our purpose is to build a connected future so everyone can thrive. It's a future that won't happen on its own, it has to be delivered — and only Telstra can bring together all the parts to create it. And, this is where YOU come in, by playing your part in help our customers connect: faster, better and smarter.
The role with us
The Senior Developer role will be develop business logic, data management and systems integration services to enable customer end users to manage their network product planning, configuration, deployment and operations.
Key Responsibilities:
Design, build, install, integrate and maintain software and integrations which implement product logic and processes to support customer, partner and Telstra employee control of complex network technologies and platforms for fixed network provisioning and operations
Translate customer (internal, external or regulatory) needs and requirements, using technical principles into reusable API based micro-services, data models, workflows, and integrations
Negotiate and agree on frontend and peer system integration API specifications to implement required user experience and end-to-end processes
Work with Product Owners and Technical Product Owners to develop business and technology roadmaps
Utilise on-premises and cloud technologies to deploy and host applications
Accountable for Backend Micro-Services, using Java
Use existing code repositories and CICD pipelines to deploy into development and production environments
Utilising Agile ceremonies and practices, lead planning, design and estimation sessions.
Integrate solutions by executing on security and operational requirements
Assess capability of third party and open source libraries and tools to meet business requirements and manage software supply chain delivery
Assess capability of internal libraries, tools, APIs and systems and offerings to meet business requirements
Develop platform-specific technology functionality for business requirements that leverage opportunities from evolving and future technologies
Participate in a DevOps and DevSecOps environment and team.
About you
To be successful in the role, you need to have:
Essential
A Tertiary qualification in Engineering, Computer Science, Information Technology or similar discipline.
Typically, a minimum of 5-10 years’ experience working in an Operational and/or Software Engineering role and have expertise with a variety of deployment, automation, configuration management and optimisation tools.
Strong experience in one (or more) of the following technologies:
Java
JavaScript
Java Springboot
NodeJS
Python
Exposure to network automation, Software Defined Networking and NFVi concepts and technology
Proven programming experience that conforms to good software engineering design principles and practices (including version management). This includes experience with API integration.
Practical experience with Continuous Integration and Delivery pipelines. Enhancing and improving CI/CD capabilities to reduce cycle time while retaining quality
Experience designing and implementing Infrastructure-as-Code, such as Terraform
Experience in delivering projects as part of an agile team and exposure to DevOps teams, practices and tools
Willingness to learn new technologies and keen to drive innovation
Excellent written and verbal communication, problem solving and time management skills
Strong interpersonal and consultative skills
Strong desire to learn and drive skills to expert level in the domain
Proactive and self-motivated
If this opportunity sounds like a perfect fit for you, we'd encourage you to apply!",3.9,79 %,94 %,"Vicki Brady
26 Ratings",3.6,3.7,3.9,3.4,4.2
Electronics Engineer,Northern Territory,Australian Antarctic Division,https://www.glassdoor.com.au/partner/jobListing.htm?pos=101&ao=1110586&s=58&guid=0000018524ae780a9a11a893914f60c3&src=GD_JOB_AD&t=SR&vt=w&cs=1_16075c64&cb=1671357692160&jobListingId=1008311651154&cpc=EA19F5B90D514204&jrtk=3-0-1gkiasu1hi9hm801-1gkiasu23jrqp800-700c7a1e196d1991--6NYlbfkN0CC4VGPMHCLJWmMDwm5peKbnTgZPYXNx63DoWy1iBmTkq0_XdHQCLYbc5cHXfn09lxpQky15pdRCWTh6xC3o2cq8C9smpllXfvN_v0ViArdETbLD26YEFPKHKK1FvAdwrt6wFInKBcKucx1dLX6vCNFi7yZBr0uIRe-QHvAGOMc3UDPRxFpG9W3KrXIjxFGm8Hpx9Nyy2Asew5Ix8bI7HTlongpG2Xz6Qaz0O18pL-B4MQpOvhpVgFM9jJGWc4IMpCBKHyEFJWRje8sTh1ywAo74a-2fwOkSGeRU8q1uEXWFN82ZLFtSKopxtqSiaIc0T9n4PA9p_2wi4rt5zaE40qSi8hUueFcFmLTSRqkR-Q9He4GLy1jeRZ7tjUQWUz6VihVWHf6i4EqiHeC-p-Bpx6HR0JONZa1E1JXB-2rSZPuzVM-DRIpCCdNJ_fM_N0BrYfr7bQwhStLel3IncfH0nVZ3qgGuewiTrF5E4CcLczRt2MovJXtntIslL45iukpPQL32BBXvKVBbPA4jspJy66Mn25gXvfvzBkhM8AsevqpVsDlXrv5kLngOZvWYUWZms--SGmnL4TdLjeUtF4na7QhSt32SXgsqGIb7KRzZkt9iR9n0WqzwUsGHo0TDWAPsvPvIb3Th5s_B88ZGvDAn9VfGye4aV4slkFaRS_E0zlWI-g6q4amOwS85cWer1TplhzLb7vPhGEKK8pleqfq88qtMZhQh4ZfD7g%3D,"$92,076",$92K,$92K,501 to 1000 Employees,Government,Government & Public Administration,1948,National Services & Agencies,Unknown / Non-Applicable,"Australian Antarctic Program
With most contracts available from 4-12 months, we’re looking for highly motivated people who enjoy working as part of a close-knit team. Bring your experience and skills and you’ll be making a real difference by helping to support climate change research. Apply now and make a world of difference today.
Australia maintains three permanent research stations on the Antarctic continent (Casey, Davis and Mawson) and one on sub-Antarctic Macquarie Island. Each station is like a small town with a diverse and dedicated workforce, comprising station leaders, tradespeople, scientists, doctors, chefs and telecommunications experts. Expeditioners are supported by head office staff experienced in Antarctic policy, law, operations, medicine, technology, science and media.
About the role
As an Electronics Engineer you will install, commission, maintain, calibrate and modify electronic instruments and systems for the collection, reduction and analysis of data. You will have good hardware and software skills. You will be technically resourceful and be able to operate with minimal supervision. You will also produce regular, comprehensive reports on the status of observatory equipment.
The Electronics Engineer is a winter job only at Davis station.
The Australian Antarctic Program’s (AAP) vision is to ensure Antarctica is valued, protected and understood. Working with the AAP provides a unique opportunity to experience Antarctica and the Southern Ocean, while supporting world-leading science.
The AAP aims to support expeditioner growth, professionally and personally, with a focus on wellbeing. We strive to employ versatile, proactive and community minded people. Expeditioners will need to contribute to a small team and be resilient as they face the challenges of living in an isolated environment.
For more detailed information about the requirements of the role and the selection process, please see the job description document and link to more information on the application process below.
Employment conditions
The annual base salary (while in Australia) is $92,076 per annum ($3,530 per fortnight before tax).
Additional allowances totalling $63,437 per annum are payable while working in Antarctica.
A generous employer superannuation contribution of up to 15.4% will be paid in addition to salary and allowances.
You will accrue recreation leave at the equivalent of 20 days per annum pro rata. Please note that recreation leave is not available in Antarctica, but will be paid out on return to Australia.
Contact
For general enquiries, please use our contact form to speak to the Expeditioner Resouring team.
For job specific (technical or trade related) enquiries, or to discuss the role in more detail, please contact the technical supervisor Damian Murphy (03) 6232 3359.
Eligibility
You must be an Australian citizen, Australian resident with work rights in Australia, or a New Zealand citizen. Please note: Jobs requiring a security clearance are only open to Australian citizens. Applications from persons who are not Australian citizens will usually only be considered where there are no suitable Australian applicants.
To apply for this role you must have the skills and licences listed below:
Qualifications/licences (provide copies in your application):
An Engineering degree majoring in electronics from an Australian University, or qualification of equivalent standard from an Australian or overseas university that is consistent with eligibility for graduate membership to the Institution of Engineers Australia.
A current, unrestricted “C” class (manual) Australian driver’s licence.
Recent relevant experience:
Detailed design, implementation and testing of analogue and digital electronic circuits and systems (including microcontroller based systems).
Ability to be resourceful and innovative in technical aspects of the work including the ability to fault find and calibrate modern electronic instrumentation. Have the ability to repair electronic equipment at a component level (demonstrated experience of such when operating with limited resources is desirable).
How to apply
All applications must be submitted via jobs.antarctica.gov.au.
Job Type: Contract
Contract length: 12 months
Salary: $92,076.00 per year",4.0,N/A,N/A,0 Ratings,,,,,
Senior Water Resources Engineer,Darwin,GHD,https://www.glassdoor.com.au/partner/jobListing.htm?pos=202&ao=1136043&s=58&guid=0000018524ae7e91a57a04410fc671a5&src=GD_JOB_AD&t=SR&vt=w&cs=1_96fb30cd&cb=1671357693856&jobListingId=1008195937961&jrtk=3-0-1gkiasvlt2ea4001-1gkiasvmfjrqp800-d9d9433251ee54a4-,"$104,890",$93K,$119K,5001 to 10000 Employees,Company - Private,Management & Consulting,1928,Business Consulting,$2 to $5 billion (USD),"Join a global professional services leader. We are committed to solving the world’s biggest challenges in the areas of water, energy and urbanisation.
GHD Northern Australia is seeking a Senior Surface Water Engineer to join our Surface Water team. This exciting Darwin-based role requires a motivated and experienced engineer to be involved in the delivery of substantive hydrology and hydraulic elements for a range of integrated projects. Candidates based in Townsville, Cairns, Gladstone, Rockhampton, or Mackay would also be considered.
Working as a valued member of the GHD Surface Water Team will expose you to some of the largest and most interesting projects being undertaken nationally and internationally. There is flexibility to define your role (whether that be technical, business development or managerial) and drive career outcomes that are most important to you. This is all while working within the hydrology and hydrodynamics service line which is comprised of a large pool of industry leaders and technical experts both nationally and internationally. Working with Team Leaders and Project Mangers, you will be involved with:
A large variety of projects including linear infrastructure, large scale renewable energy and sustainability projects, risk-based assessments for large dams or tailings facilities, and conventional flood studies
Acting as Technical Lead, Project Manager or Project Director to guide key projects and mentor other staff
Overseeing the application of software tools in a strategic manner to facilitate impact assessment, risk assessments, concept design, and compliance
Business Development
A team committed to ongoing innovation.
What you will bring to the team:
A degree in civil engineering, environmental engineering, data science/ analytics or similar with industry experience
Recognizing that not everyone has the same set of skills, we are keen to see where your strengths lie. Skills relevant to this position will include many of the following
A fundamental understanding of relevant guidelines and methodologies relevant to your skills (e.g., ARR 2019 methodologies and techniques)
Applied experience supporting infrastructure design through the application of various hydrologic and hydraulic packages
Hands-on experience with a range of software will be viewed favourably. GHD utilizes a vast array of hydrologic, hydraulic, hydrodynamic and water balance packages including Goldsim; 2D hydraulics such as Tuflow and HECRAS; GIS and other compatible software
Experience with other high-end software such as CFD (computational fluid dynamics), risk assessment software (LifeSim), programming packages (Python or R) or civil design packages (12D/ Civil3D) will also be viewed favorably.
Interested? Apply now
Contact Hennie Coetzee
T +61 7 3316 3379
GHD embraces hybrid work arrangements to create a work environment focused on well-being, flexibility and productivity where GHD people can thrive, this supports the diverse needs of our workforce while balancing the benefits of remote working with the value of face-to-face collaboration in the office.
There may be government or client requirements which require an up-to-date COVID-19 vaccination for this position.
GHD is an equal opportunity employer, and we want everyone to be able to fully participate in our recruitment process. We value a diverse workforce and an inclusive culture. We encourage applications from Aboriginal and Torres Strait Islander peoples and people of all identities.
We respectfully ask that no agency resumes be presented at this stage .
** Please note GHD offices will be closed from Monday 26 December 2022 and reopen on Monday 9th January 2023. We will be in contact in the new year once all applications have been reviewed. **
#LI-HC1

Why GHD?
Being the best we can be is in our culture.
We are a family of smart, innovative and creative problem solvers. In our employee-owned company, everything feels like it matters more. Challenge us and help us come up with new solutions to ensure water, energy and urbanisation are made sustainable for generations to come.

More about Life and Work @GHD

Our commitment to you
Commitment is a powerful word that defines how we do business, how we serve our clients and how we care for one another. We will support your needs by giving you the tools to do your best work and then recognise achievements. We will set your curiosity free to allow brilliant minds to do their best work. We will invest in new ideas, removing barriers where we can. Finally, we will encourage you to collaborate with thousands of diverse people across our global business.

Our Commitment to you

Who we are
We are committed to solving the world's biggest challenges in the areas of water, energy and urbanisation . GHD is a global professional services company that is a leader in engineering, construction and architectural expertise. Established in 1928, we remain wholly owned by our people. We are 10,000+ diverse and skilled individuals, yet we are proudly ‘One GHD’ across more than 200 offices, spanning five continents – Asia, Australia, Europe, North and South America, and the Pacific region. Delivering extraordinary social and economic outcomes, we are passionate about building lasting relationships with our partners and clients.

GHD Expertise and Service Lines",3.7,71 %,83 %,"Ashley Wright
395 Ratings",3.6,3.1,3.7,3.2,3.5
Navy Careers (No Experience Required),Northern Territory,Royal Australian Navy,https://www.glassdoor.com.au/partner/jobListing.htm?pos=102&ao=1110586&s=58&guid=0000018524ae780a9a11a893914f60c3&src=GD_JOB_AD&t=SR&vt=w&ea=1&cs=1_40315d5f&cb=1671357692161&jobListingId=1008317077187&cpc=47CFDC01B3F81FAC&jrtk=3-0-1gkiasu1hi9hm801-1gkiasu23jrqp800-9fac545773da0475--6NYlbfkN0CZQ85SbDtOFFmw_HlyoPhAYo__7zSpFajohgTRIczH_cDbXY6Hh0t9V2OwPIexPnx_shBl8QQPqqF7aveNk4La3amXh_Sh2YzrAFc31TLY3qRzLItdLEraN2SKcBHg8iL25_LXuCB_toLFL4gzwfS8IffLGu1tdMuILXn6x3lCfYBVBdfMAqKuew9vLDVt1xyzv6wSYF7zi7KBf3acB4w6ep5fEgGoCHluauKSCfr6fkkuQNvrfBj8WoLUCJYUfANQoHaTYXc5OrYgGQLXEQFrBDjenwRujXRJq7xx4CCHwtQGsiMPhUegA_rBHoFUdjf0tXu_bDC7PFaVfzA4RiRusW8yECUZPNh4Jv6GmJMAKpV0KTFaWDCZRTMIaCIdXRw2EPVdA-TUQWhNpwZIxxKfskKwAWwPai6BFkSnhU2rePBI-Ewk2MWmwR-exdsSMSUc-may5wMjg12nvnEyj_pBGjI_-CXlGJmFX4Gq0pGn7coISVpwnMi-Taf57G3RaZrC3irQvRwpVOWUvD2qfdvNQB21yQ89tSgfBPZa_jDY9MAxxbD_yh9_xQdcz-rUb-25Cpl7bnsOiOuzY-YABARYQ2G0YYTYS92Yw1qW3AwUagPdSxRugViH,"$82,500",$75K,$90K,10000+ Employees,Government,Government & Public Administration,-1,National Services & Agencies,Unknown / Non-Applicable,"Are you looking to join the Navy sooner and fast-track your application? You can accelerate your career and start training in the next 3-6 months by applying for a priority role.
Whether you have recently finished school, currently studying, already in the workforce or you have no experience at all, we’re hiring. You’ll be paid from day one to gain all the skills needed with extensive on-the-job training. You may also be able to use your existing qualifications and be eligible for recognition of prior learning.
You’ll enjoy a competitive salary package, career stability, opportunities for continuous progression, and an adventurous lifestyle – all while making a difference to Australia.
Browse full-time priority roles below:
· Electronics Technician
Maintain, diagnose and repair state of the art technology and military hardware, onboard ships or submarines and ashore. You could be working with radars, sonars, satellite equipment, navigation aids, weapons systems, torpedo launchers and more.
· Marine Technician
Operate, monitor and maintain engineering systems and machinery to ensure equipment and technical systems onboard ships or submarines run at optimum capacity.
· Communications & Networks Operator
Be responsible for making sure communications and information is sent and received securely. Your duties include operating satellites, radios, IT and network systems, flashing lights (Morse code), flag signals and more.
· Weapons & Sensors Operator
Specialise in collecting and analysing sensor information and using combat data systems to make recommendations that inform tactical decisions and avoid potential threads.
Submariner:
There is also the option to specialise in some of these roles as a Submariner and be a part of the most exclusive and stable workforce in Australia. You will have a direct effect on Navy missions and operations at sea.
Benefits:
- Free medical and dental
- Competitive salary package
- Incremental salary increases as you progress through training and ranks
- 16.4% superannuation
- Job security
- Career progression and development
- Good work/life balance
- Travel opportunities
- Excellent social and fitness facilities
- Subsidised housing
- Balance of shore and sea postings
- Great chef made meals at sea
- Variety of allowances
Salary:
Upon completion of your initial military and employment training, you’ll enjoy a salary package starting from $75,451 for surface fleet and $88,437 for submariners.
Apply Now:
For these roles, you must be over 17 at time of enlistment, an Australian Citizen and have passed Year 10 with passes in English and Maths. Some positions may also require passes in Science.
Visit the link below for the full position descriptions:
https://navy.defencejobs.gov.au/priority-roles
The Australian Defence Force is an equal opportunity employer. This advertisement is to ensure women are aware of the rewarding and fulfilling careers available in the Navy, Army and Air Force. Females are encouraged to apply, however all roles are open for Australian men and women to apply.
Job Type: Full-time
Salary: $75,000.00 – $90,000.00 per year
Licence/Certification:
Australian Citizenship? You must be an Australian Citizen (Required)",3.2,49 %,38 %,"Vice Admiral Tim Barrett
60 Ratings",3.5,3.6,2.9,2.3,2.3
