Management Consultant Manager,Darwin,Power and Water Corporation,https://www.glassdoor.com.au/partner/jobListing.htm?pos=124&ao=1136043&s=58&guid=0000018524ae780a9a11a893914f60c3&src=GD_JOB_AD&t=SR&vt=w&cs=1_bb70352a&cb=1671357692165&jobListingId=1008341562262&jrtk=3-0-1gkiasu1hi9hm801-1gkiasu23jrqp800-fe821e3dbfae457c-,"$113,323",$94K,$137K,501 to 1000 Employees,Company - Public,-1,-1,-1,Unknown / Non-Applicable,"Northern Territory Government

JOB DESCRIPTION

Job Title Enterprise Portfolio Management Office Performance Manager

Classification Band 4 Administrative and Corporate Services Position No. 43349

Job Type Full time Duration Ongoing

Business Unit Customer, Strategy and Regulation Location Darwin

Reports to Senior Manager, Enterprise Portfolio Reports to P/No. 42159

Management Office

Power and Water values diversity in the workplace. Therefore, under an approved Special Measures Plan,

Special Measures Aboriginal and Torres Strait Islander (Aboriginal) applicants will be given priority selection, provided they meet

all essential selection criteria and are suitable at the level commensurate with the position.

Information for Applications must be limited to a one-page summary sheet and an attached resume/cv. For further information

Applicants for applicants and example applications: click here

Information about If you accept this position, a detailed summary of your merit (including work history, experience, qualifications,

Selected skills, information from referees, etc.) will be provided to other applicants, to ensure transparency and better

Applicant’s Merit understanding of the reasons for decision. For further information: click here

PRIMARY OBJECTIVE

The Enterprise Portfolio Management Office Performance Manager is responsible for leading the analysis of information to provide

transparent and accurate performance reporting for multiple companies and regulatory bodies, to the Executive Leadership to make

informed decisions with confidence. The position supports the development and maintenance of process and procedural material. The

role requires the Enterprise Portfolio Management Office Performance Manager to consult and collaborate with all levels of the

corporation.

KEY RESPONSIBILITIES

The “WHAT” to be delivered

Lead the EPMO Performance Management service responsible for oversight, development and maintenance of executive level
performance reporting to achieve alignment to strategic objectives and direction.

Lead the EPMO Master Scheduling and Resource Management service, responsible for the development and maintenance of a
master portfolio schedule enabling oversight of resource management, prioritisation and delivery pipeline; and provide training

and guidance for the development of program and project schedules.

Lead the EPMO Benefits Realisation Management service, responsible for alignment and performance reporting of the
investment portfolios to the strategic objectives.

Exercises diplomacy and judgement in difficult situations and act under own initiative to respond pro-actively in a changing and
dynamic environment.

Ability to manage upwards at Senior Management level and obtain support in an environment of conflicting priorities and
perspectives.

COMPETENCY PROFILE

“HOW” to do it (Manager of Team profile - refer to Power and Water’s Behavioural Competency Guide)

Builds effective teams Building strong-identity teams that apply their diverse skills and perspectives to achieve common goals.

Courage Stepping up to address difficult issues, saying what needs to be said

Cultivates innovation Creating new and better ways for the organisation to be successful.

Customer focus Building strong customer relationships and delivering customer-centric solutions

Directs work Providing direction, delegating, and removing obstacles to get work done.

Interpersonal acumen Relating openly and comfortably with diverse groups of people

Plans and aligns Planning and prioritising work to meet commitments aligned with organisational goals.

Resourcefulness Securing and deploying resources effectively and efficiently.

MANAGEMENT RESPONSIBILITIES

No. of Direct Reports 3 No. of Indirect Reports Nil

Key Interactions: Executive Leadership Team, Senior Leader Group, All Employees, External reporting parties

COMPLIANCE

LAST UPDATED: November 2022 EMPLOYEE SIGNATURE: __________________________ DATE: ____________

AT POWER AND WATER:
Job Description Northern Territory Government

We expect you to:
Actively align, support and promote Power and Water’s Values and support building a constructive workplace culture that celebrates
achievement through its people.

Carry out duties in accordance with Power and Water’s Safety and Environmental policies and procedures, working towards our goal
of Zero Harm.

Ensure all activities undertaken as a Power and Water employee comply with Power and Water’s Code of Conduct , Management
Standards and Procedures, relevant Acts, legal demands and that you manage all of your activities and responsibilities within the

Power and Water risk management framework.

SELECTION CRITERIA

Qualification and Skills Experience

Essential  Advanced skills in Microsoft 365; specifically Excel,  5+ years’ experience in an analytical and reporting

Power Platform, Power Apps or Power Automate services

Highly developed written and verbal  Extensive experience in building and cultivating
communication skills to effectively relate data to relationships at all levels and being able to adjust

key stakeholders quickly understand and deal with a business

Highly developed organisational skills, particularly situation in a manner that is likely to lead to a good
the ability to balance conflicting priorities and meet outcome.

deadlines in an environment undertaking  Demonstrated ability to turn data into consumable

continuous improvement and change information, identifying trends and exceptions

Demonstrated analytical and critical thinking skills
with a proven ability to work within complex

systems and apply creative solutions

Desirable  Project management accreditation or tertiary  Previous experience in project management office

qualification in data science, information or project management delivery

technology or related field  Experience in a utilities industry and a knowledge

Performance report specification writing. of asset management similar to those of the
Corporation

FURTHER INFORMATION

1. Contact Carmen Mitchell, Senior Manager Enterprise Portfolio Management Office on 0477 443 350 for further information about

the position.

2. Information about Power and Water Corporation may be viewed at powerwater.com.au

3. The total remuneration package amounts published for this position include base salary, superannuation and annual leave loading

and the value of an extra week’s annual leave.

Apply Online https://jobs.nt.gov.au/Home/JobDetails?rtfId=249587 Approved December 2022

Vacancy Closes 04/01/2023 Jason Howe - Executive General Manager Customer,

Strategy and Regulation

AT POWER AND WATER:",3.8,85 %,N/A,0 Ratings,3.4,4.0,3.8,3.2,4.4
Field Manager,Darwin,Manpower,https://www.glassdoor.com.au/partner/jobListing.htm?pos=125&ao=1136043&s=58&guid=0000018524ae780a9a11a893914f60c3&src=GD_JOB_AD&t=SR&vt=w&cs=1_bd2667e4&cb=1671357692165&jobListingId=1008112434846&jrtk=3-0-1gkiasu1hi9hm801-1gkiasu23jrqp800-a9ca4c1eae9b9d45-,"$66,266",$59K,$74K,10000+ Employees,Subsidiary or Business Segment,Human Resources & Staffing,1948,HR Consulting,$10+ billion (USD),"Fantastic and Competitive Day Rate
Immediate Start -Initial 6 month placement
Leading Energy Company
Our client is a subsidiary of one of the worlds' leading integrated energy companies, delivering quality products and services across Australia. They have a fantastic opportunity for an experienced HSE Field Professional to join the team on an initial 6-month temporary placement in Darwin to support the Operational excellence and Management Systems Processes.

The primary purpose of the position is to act as Subject Matter Expert for operational excellence and HSE management system processes. Providing HSE expertise, guidance and coaching to line supervisors and leadership to achieve system compliance and performance outcomes.

Key Responsibilities include but are not limited to:
Provide guidance and coaching on safe work practices, human and organisational performance,
Risk management including risk assessment and safeguard verification, environmental risk management and dangerous goods compliance.
Support assurance activities, field level emergency management and response contractor qualification and day to day contractor HSE management support,
Internal & external incident / environmental reporting (including regulator interfaces) and delivery of all OE-HSE related training.

The successful candidate would demonstrate the following:
Strong HSE process and system knowledge in core HSE processes such as Incident Investigation and Reporting (IIR), Risk Management, Managing Safe Work, Document Writing and Development, Environmental Management, Contractor Management, Emergency Response, Security, HSE and Dangerous Goods Legislation, Regulator Engagement, Assurance Processes.
Inductions, Training and coaching skills.
Demonstrated ability to coach, influence and build HSE competency in others.
Proven experience and tertiary qualifications that allow the person to speak with authority, competence and clarity on key HSE processes and practical HSE process field application.
Ability to analyze data and information to make sound decisions and efficient solutions to issues and problems as they arise.

This would suit a HSE professional with a minimum of 5 years' experience in a chemical plant or refinery or working as a HSE professional with other major O&G downstream companies.

""Minimum Bachelor's degree in Safety Science, Process Safety Engineering or HSE related discipline required""

Interested? Shortlisting taking place now! Hit the link to apply or call Michelle Mortimer at Safesearch for a confidential chat.
Michelle Mortimer
Senior Consultant
Let's Connect

ManpowerGroup is committed to being a Diversity Confident Recruiter and encourages applications from people from a diverse range of backgrounds, including people with a disability. Please indicate your preferred method of communication in your resume and please let us know if you require any reasonable adjustments should you be contacted for an interview.
Aboriginal and Torres Strait Islander people are encouraged to apply.
By submitting your resume and other personal information with this application you are consenting to this information being collected in line with our privacy policy. Follow the link to learn more - www.manpowergroup.com.au/privacy-policy
Experis Pty Ltd is a wholly owned subsidiary of ManpowerGroup
State: QLD, licensee/s Manpower Services (Australia) Pty Ltd, LHL-02026-D5L4Q. State: QLD, licensee/s Experis Pty Ltd, LHL-02014-Y5F6D. State: SA, licensee/s Manpower Services (Australia) Pty Ltd, LHS 288856",4.1,84 %,87 %,"Jonas Prising
1984 Ratings",4.0,3.8,4.0,3.9,4.0
Compliance Officer Manager,Darwin,Dash Group,https://www.glassdoor.com.au/partner/jobListing.htm?pos=126&ao=1136043&s=58&guid=0000018524ae780a9a11a893914f60c3&src=GD_JOB_AD&t=SR&vt=w&ea=1&cs=1_96018a69&cb=1671357692165&jobListingId=1008330114961&jrtk=3-0-1gkiasu1hi9hm801-1gkiasu23jrqp800-a9edee62a0129a16-,"$200,000",$200K,$200K,Unknown,Company - Public,-1,-1,-1,Unknown / Non-Applicable,"Relocate to Perth
Excellent Mine Life
Extremely Diverse Role

My client is seeking an experienced and enthusiastic Stakeholder and Compliance Manager for a Perth based role.

Reporting to the Chief Executive Officer, this unique role is responsible for establishing environmental management system (EMS) and delivering on business objectives in compliance with all environmental, community and cultural heritage related regulatory requirements.

About you:

Qualifications/Certificates & Licenses:
Bachelor’s degree in Environmental Science or a similar field.
Current “C” Class Western Australian driver’s license.

Knowledge:
Demonstrated understanding of the Western Australian environmental approval, governance, and compliance processes.
Knowledge of environmental management systems.
Advanced computer literacy and business software knowledge. Working knowledge of GIS systems is an advantage

Experience:
Minimum 10 years’ experience in the resources industry.
Track record in preparing project approval documents for resource projects.
Significant experience in management of permitting and approval activities
Demonstrated experience in preparing and submitting compliance reports to State and Commonwealth agencies.
Ability to communicate with a confident and compelling message to a wide range of stakeholders.
Established approach to being able to effectively source, gather, interpret, and communicate quantitative and qualitative data.
Well-versed in stakeholder consultation and achieving positive outcomes with government and community stakeholders

Leadership:
Lead, mentor, and coach the Environmental team.
Provide guidance to the executive and leadership team on all aspects of environmental statutory requirements.
Facilitate environmental awareness sessions for site personnel

Skills, Behavioral and Business Acumen:
Friendly and professional disposition.
Well-developed influencing, communication, and consultation skills.
Capacity to handle complex situations and make decisions under pressure.
Fosters close working relationships with stakeholders, employees, and contractors.
Strong numerical and analytical skills.
Strong oral and written language skills.
Proven ability to meet deadlines.
High level of emotional intelligence.
Focused on and committed to promoting safety awareness.

Key Relationships:

Internal
CEO
General Manager
HR Manager
Commercial & Marketing Manager
WHS Manager
WHS Superintendent
Process Manager
External
Relevant State and Commonwealth mining, environmental and indigenous government departments
Traditional Owner groups
Local Governments
Non-Government organization's and community groups
Local pastoralists
Consultants

Accountabilities:

Environmental Management System
Develop and maintain the Environmental Management System (EMS.)
Lead environmental sustainability to ensure continuity of operations through positive environmental stewardship.
Develop, implement, and maintain internal procedures to ensure compliance with Approval and License conditions

Stakeholder Management
Liaise, communicate, and build a strong rapport with external stakeholders including native title holders, pastoral leaseholders, local communities, and shires.
Work closely with WHS on environmental monitoring and compliance matters
Engage consultants to conduct investigations and monitoring as required.

Compliance
Obtain environmental, water and mining permits.
Ensure permit conditions are understood by the relevant permit owner.
Maintain a register of all permits, including details of permit conditions and internal permit owners.
Ensure compliance with Heritage Agreements are met.
Implement approved environmental plans and initiatives to reduce liabilities and risks.
Conduct regular audits and inspections to ensure environmental standards and regulatory requirements are met.

Safety
Actively promote safety and demonstrate a personal commitment to safety.
Implement approved environmental plans and initiatives to reduce liabilities and risks

Analysis and Reporting
Submit relevant compliance reports to State and Commonwealth Departments as required.
Prepare reporting metrics for weekly meetings.
Generate monthly analytics for company reporting.
Prepare annual sustainability report for the company.

If this amazing role sounds like you and you are willing to relocate to Perth, please apply or send your resume direct to reneeb@dashgroup.net.au for a confidential discussion.",3.9,100 %,N/A,0 Ratings,2.9,2.0,2.5,3.5,4.0
